240,Stop treating developers like they aren't human beings. Stop expecting unrealistic deadlines and hound them to finish. Fear driven development leads to triggering these mental episodes. People with a disorder want and can function Ina. Work environment. But there has to be proper training and awareness for this in the workplace to be mindful. This in turn works out positively even for those without a diagnosis. the tech industry needs to treat people better period.,0
241,"To much hate directed towards people with mental illness, especially in the Northeastern Ohio tech community(Akron/Cleveland)",0
243,Hire psychologists ,0
244,"Communicate more effectively, reduce stressor levels, assure training for managers and senior leaders.",0
245,remove stigma,0
246,They should express awareness of mental health issues and that they know how people struggle with sharing and seeking help because of shame and stigma. They should value and model vulnerability and then follow through by providing support.,0
248,"some are supportive and have systems in place to support employees, others dont",0
249,"Better understanding of how the issues can manifest in the workplace for ""hidden"" disabilities ",0
250,Reduce unrealistic deadlines that cause stress.,0
252,"don't make people have to ask for what mental health resources, benefits, etc are available. provide this info up-front and make it as accessible as possible.",0
253,I'm not sure.,0
255,"Fuck the taboo over.  Make it have equal weighting as physical wellness overall in any official documentation and openly discussed in the same sentence as physical wellness.  Ensure that an inclusive culture is promoted and take a hard line on it.  Make education programmes available, perhaps compulsory for managers.",1
256,train managers,0
260,i think i will improve,1
261,"There have been great strides recently, but if employees/ corporations would do more to help employees dealing with mental health issues, it would help.",0
263,Better health care options.,0
264,Work to remove the stigma; let emloyees know it's cool to talk about it and remove the fear of having a mental illness impact your job.,0
265,Just treat it the same as physical health and make big efforts to be on top of physical health.,1
267,"allow people to breathe, fail, and learn. ",0
268,duh,1
269,Offer more resources and education.,0
271,Less emphasis on always being on and always working.  Less emphasis on winning the startup lottery.  More emphasis on being whole persons and.  More emphasis on balance and creating time for yourself and your family.,1
272,"Explain that some behaviors that we have deemed successful are actually outside of mental health norms. Educate on what those types of disorders look like by example, not in abstract terms as they are diagnosed. Personal, honest accounts of dealing with it, i.e. Gregg Bauges",1
273,"I think as it becomes more visible and people are learning, the companies are taking the lead and giving options for mental health care. ",0
274,we need care and support and open environment to discuss. people who cannot be supportive should not work here.,0
275,My current employer is great and very supportive with my illness. However I believe my employer is an exception not the rule.,0
277,"Be more proactive in identifying likely triggers for issues (stress, excessive work load, inability to adjust team composition, etc.) and avoid those.

Be more forward with educational resources and making clear what options are available to anyone having any kind of issue, be it mental condition or life-stress.",0
278,Start talking about mental health.  Educate people managers to be more aware of mental health issues and to discuss them openly.,1
279,IT/Software companies tend to be a bit better than other sectors of business,0
281,Openly listening to employees issues and referring them to appropriate organisation for support,0
283,Remove the stigma.,0
286,"I really have no idea. I know that I cant be the only one who suffers from it, maybe if people were encouraged to be open about it? There is still a pretty strong social stigma on mental illness so I dont know who that would go",0
287,I have no thoughts to offer.,0
289,"They need to know that we have an issue like they have theirs, just because is ""trendy"" does not mean that we are special or not capable of being a good worker to have around, we all have struggles, and we know how to handle that so the company and coworkers don't suffer from it ",0
292,Increase awareness with annual talk about mental health.  Improve outreach programs.  More flexibility and less emphasis on delivery and over working.  I feel mostly that tech evangelizes working too many hours.,0
293,Put as much effort into raising awareness for this leading cause of death and disability as they do for diversity and wellness initiatives.,0
295,"Stop treating some issues (ADHD, Autism-spectrum disorders) that may or may not affect performance as badges of honor, while promoting work conditions that lead to other mental health issues (anxiety and depression) that more negatively impact workers.",0
297,Encouraging mental health as a valid reason to take a day off or some time away. Recognizing and rewarding those who take mental health seriously as much as they reward and revere those who throw it away to get stuff done. ,1
298,I think overall wellness education to be forefront in the minds of employers and provided appropriately for employees.,0
299,"Simple awareness of, acknowledgement of, and sharing about them would be a good first-step.",0
300,"
",0
301,I don't know.,0
302,"Open discussion of mental health coverage, issues, and treatment options, without stigma, in line with similar for physical health. ",0
303,"Diversify beyond Silicon Valley and its societal values, which inherently seem to allow for mental health to be misjudged.",0
304,Hold trainings to normalize mental health issues.  To help reduce the stigma and reinforce how prevalent they actually are and how with treatment people with mental health issues are the same as everyone else.  ,0
306,Having a clear mental health policy that is well known by all.  Providing privacy for discussion.  Providing anonymity for people dealing with mental health issues.  Talking about the importance of mental health.  Taking steps to ensure mental health is maintained.,0
310,"The tech industry fails to address mental health adequately by failing to recognize that mental health issues affect cognitive abilities, and those cognitive abilities are what make our jobs work.",1
311,I think competition and ego drives a lot of people to prioritize work over mental health.  The tech industry doesn't do much to discourage that practice.   There's also a ton of toxic masculinity that leads to a culture of hostility towards emotional responses or acknowledging mental illness. ,0
312,"Less stigmatism, and more understanding. Better options to seek treatment. Less expensive options for treatment.",1
313,"Make treatment options more widely known, work to decrease stigma surrounding such issues",0
314,They could offer better benefits and estimate timelines better (or offer some flexibility) so that people are able to take time to take care of themselves,0
315,"Society as a whole doesn't understand or support mental illness. I just saw my primary care doctor at Kaiser, and he told me to ""get back to work soon"" while I am fighting for a reason to keep on going with this severe depressive episode (I have bipolar 2)",0
318,I think a lot more conversation and openness- employers and teammates treating mental health as seriously as physical health,0
320,"I feel there's not enough awareness around mental health issues in general, nor their impact on developers. In particular, anxiety and depression can lead to a spiraling situation where one does not feel capable of doing the work. Having supportive co-workers who can both pick up the slack, as well as coach you through those times, can make a huge difference to the organization as a whole. Feeling both like you belong and are accepted is a huge step for many.",1
323,Help employees not feel ashamed of it.,0
324,Make it clear that there is no punishment or reprisal.,0
325,it's not enough to have services / benefits available. It's about actively encouraging good behaviors/positive reinforcement,0
326,?,0
328,"A work place culture that respects personal life is most important: flexible schedules, work from home, asynchronous communication that can be silenced when off duty, …. Quiet working conditions also reduce stress. Teams that enjoy working together are good for all involved.",0
330,Employers need to make a real effort to support their employees who may be going through mental health issues,1
331,"Be more open about it, talk about it.",1
332,"maybe stop with the ""indestructible tech guys"" myth, show the employees that it's ok to be vulnerable",0
333,The most people I see in the industry don't like to talk about it. That makes it difficult to improve the support. As long as there is a safe place with people you know good it is possible.,1
334,Make explicit effort to gauge if employees have ongoing issues and how work environment/situation might impact and be impacted by that.,0
335,"Allow for recognition of crisis days , allow working from home and other flexible was to reduce impacts of issues",0
337,"less deadlines and they should understand work is always going to be there so not to label any work as urgent and ask someone to do overtime and accept what they deliver in office hour as work for the day. lunch time to be 1 hour than 30 minutes in most offices. many of my colleagues eats at their desk staring at their emails or doing some sort of office work, not productively but i can see the stress of not being able to eat at proper lunch time and in bit of peace. ",0
340,"Good question.  Maybe they could make it more supportive for women, first?  Maybe it would help both.",0
344,"Tools, resources, open communication",0
345,"Treat it essentially the same as physical health issues.  Make it clear that mental and physical health of employees is important, and provide information to support both.",0
350,Openly discuss and provide resources on metal health issues,1
351,"Talking more openly and normalising openness and discussion.
Have leaders speak out about their experience with mental health problems.
Mental Health First Aid programs in workplaces.",1
352,"First of all learning about it, and then talking more with his employees.",1
354,No clue,0
355,Talk about it more.,1
356,"less crunch, more time to do non-work related things.",0
360,More empathy is needed. ,0
361,Industry-wide I still don't see it talked about much outside of people  know who interact with OSMI.,0
364,Talk about it openly and often. Offer services.,0
365,Just have a base health insurance model. This applies mostly to non-EU companies.,0
367,"I think this depends on the company. My former company(ies) were pretty bad. My current company is excellent. We have a mental health channel in slack, mental health benefits are often and openly discussed, both in-patient and out-patient services. Folks are encouraged to take mental health days if necessary and encouraged to discuss what they're going through with others. That being said, the company is facing a tough financial time so recently, the encouragement to take PTO, etc. has decreased and stress level has increased.",1
368,Educate employees about mental health and what wellness looks like. Encourage them to regularly check in with themselves and maybe complete self-assessments so they can notice if they're not doing well. Encourage open discussion about the topic to normalize it and make it easier to discuss with managers. Encourage people to take mental health days and respond positively when they say they need to.,1
369,Acceptance that these issues are real,0
370,"I think the more open we are about mental health, the better, but I also think we need to acknowledge that poor mental health is a significant liability. Knowledge work needs people with healthy minds.",0
372,"Talk about it, include it in healthcare packages, provide stress-relief tools and methods",0
373,We have a reasonable health system in the Netherlands ,0
374,empaty ?,0
378,Empathy,0
382,Recognize that all our work is mental.,0
383,"Discuss it more openly. Drive discussion on education and away from stigma. More actively discuss treatment. Improve benefits in this space. Ensure insurance improves its policies and pay,ents to providers. ",0
384,Companies should cover mental health issues and disorders on health coverage and create campaigns to encourage people to get treatment or openly talk about those ,0
385,"talk about it more.  physical health is always front & center w/ ""wellness"" programs",0
386,Assurance from companies that anonymity and full support will be guaranteed ,0
387,Need hospitality and humanity,1
388,Start caring and promote mental health care,0
389,Care only about individual performance ,0
391,I have no idea.,0
393,"More openness and awareness of health benefits (insurance, wellness programs, etc)",0
395,idk,0
396,"Stop putting an emphasis on the glory of overwork, classify mental health and physical health in the same type of leave reason. Also it's important to have a culture where you're not required to explain why you need leave.",1
398,"Attitudes towards mental health are tied in to much broader issues of whether employees are treated as humans (with kindness and compassion) or as resources (which produce profit). It's hard to change attitudes towards mental health without changing the whole culture.

A lot of tech culture in particular encourages long hours, overtime, crunch times, and other practices that promote overworking. While these business can be supportive on the surface of mental health, their practices are rarely beneficial for it.

More generally, outreach and open discussions can set examples for mental health discussions. Especially having management and team leads talking openly about their mental health can result in others feeling they have permission.",0
401,Need improvments,0
402,Continue challenging stereotypes around mental health,1
404,Often emphasis is on results only. If anything is in the way of that people are pushed out.,1
405,Development of more support groups. I feel that this would give employees a stronger support system when they're having trouble coping with their mental health disorder/issue.,1
406,"Don't wait for an employee to bring up a problem. Be proactive about mental health for all employees. Bring in experts for periodic check ups and screenings for anxiety, depression, etc. Learn about and teach non-violent communication and expect team members to use those tools at all times. Do not reward overworking.",0
409,Recognize the existence of mental health issues and provide proactive support ,1
410,Openly discuss the issues.,0
411,I doubt there is anything that could be done that would let me trust industry or employers,0
414,"First: acknowledge it, and that it affects us. The hero-worker-culture is toxic. ",0
417,Reducing workplace toxicity (esp. ableism); reduce needless stress & management/communication styles involving unscheduled dropping by one's office.  Not communicating the agenda of meetings scheduled on short notice is also an issue.,0
418,Be more open about it,0
419,"Say openly that ""sick"" days can be used for any type of illness. Being too anxious, too stressed, too depressed to come to work or to do work COUNTS and is a valid and accepted reason to call off (and doesn't need to be disclosed. Saying ""I'm taking a sick day"" should be the only thing that's needed. Also, can we call them ""Wellness days""? You're not taking the day off to be sick, you're taking the day off to get well? ",0
420,Make it easier for managers to provide adjustments for those suffering ,1
422,"Emphasise work-life balance, de-emphasise the ""hero"" stories of working late.",0
423,Remove stigma and negative consequences of sharing that information,0
425,"Train manager to recognise early signs, change some aspects of the culture, like ""heroes working 24/7"".",0
426,Embrace awareness of common mental health issues like depression. Many folks don't understand it's just like any other health issue and may blame the person for poor performance,0
428,"I can’t only speak to my industry, so I have no idea if the tech industry is better or worse than most. But generally, I feel mental health to be very openly discussed and supported in the general community. I think it’s great that so many employers (mine included) actively help those with mental disorders. ",1
430,"First off, I think it's really hit-or-miss. Some places are probably great and everywhere else is probably terrible. I think it's like diversity in that everyone should take a course where they find out about a bunch of the possibilities and thus give everyone a baseline. Many people have no experiences and thus just have no idea and may not have an idea they have no idea.",0
432,Kill all rockstars (half kidding) (but only half).,0
433,"Acknowledge flexible working arrangements (remote working, flexible schedules) as a standard benefit, provide more explicit medical coverage for mental illness, remove stigmas, do not encourage crunch time/overwork as a heroic quality.",0
434,Give people room for own decisions and a digital quote in management,0
435,"Consistently use top-level descriptions like ""wellness"" or ""health"", emphasising that ""mental"" is a subset of ""physical"". Recognise that health issues are actually very common. Work with people to accommodate health issues.",0
437,Stress and effects are underrated,0
438,"more informations about things frequently encountered (depression, ptsd, etc.), infos about how to get help, formation for managers and like to better understand that. to be able to ""isolate"" and reduce stress/work on a worker and better confidentiality to talk about that.",0
440,More openness; more attention to this ,0
442,Actually admitting that mental health affects life of employees badly. And not to think of them as a resource.,0
443,"A focus on sustainable work patterns, shorter days, and flexible schedules will benefit all employees, but will especially benefit employees with mental health issues",1
444,Provide support (at all) and publicise it internally. ,0
445,Treat as normal as occasional cold / sickness,0
446,"As burnout is becoming a well known problem, It seems to me that now, thing are starting to change positively",0
447,Consider mental health a part of overall physical health. They are not separate.,0
448,Awareness,0
449,Provide preventive doctor appointments like they do with chiropractic or accupunture as part of the medical plan,0
452,"Bigger organizations might be able to self-insure and provide better benefits. Smaller ones have to rely on health insurance programs. Overall, it's also hard to find good MH providers.",1
457,I don't know,1
458,"more communication - I would say basically the whole system is not ""human"" enough ; why would you expect the tek industry to be different ?",0
459,"Openness about the issues, killing the start-up culture of overworking with fire",1
461,hold it in the same regard as physical health. Don't discriminate against those with mental health. Encourage sharing of mental health status amongst teams. Don't fire people for not being mentally well,1
462,More resources and third-party expert help.,0
463,"It's getting better, but too much hinges on speed (to market, capital burn, etc...) to care that much about employee mental health, at least in SV startups. Outside the valley things are a little less frantic",1
465,No view,1
466,"Like the rest of the US, the industry treats mental health like a joke. We're supposed to work 80 hours, down coffee and sleep pills, and not be ""brilliant jerks"" or ""lazy"". Man, it's almost like we shouldn't be exempt employees.",0
467,Educate and inform the workforce. Place the importance of mental health equal to physical health.,0
468,Encourage awareness and discourage stigma - this should come from upper management. This should be done by setting examples somehow - people need to see it happening. ,1
469,"Even when we have access to services, and even when we know we have that access, our industry and the companies I've worked for, don't make it clear that it's OK to talk about this stuff or ask for help and accommodation.",0
471,"We should encourage employees to have days to recover mentally when necessary, and to have manageable hours of work, 8 or less a day.

And discourage weekend working.",1
472,Remove the stigma,0
473,Continue to work to remove stigma. Create a safe place for workers to find and provide support. ,1
476,No questions asked health insurance coverage for mental health. No 10 day limit on PTO. Do not limit sick time to physical issues that warrant doctor's notes. ,1
477,"more awareness,more clear avenues of support, less stigma",0
478,"I see an overall shift in the stigma surrounding mental health as lessening, but we still have a long way to go. Openly discussing and making others aware of mental health issues have helped tremendously.",0
481,"The stigma is pervasive/societal, but encouraging self-care and taking time off might help those who are struggling.",0
484,"acknowledging there are many people drawn to tech for many reasons, some of them include mental and physical health reasons. knowing there are friends, coworkers, and superiors who might struggle can humanize the issues.",0
485,Talk about it.,0
486,"It is frequently discussed that engineers are a ""certain type"".  From that perspective I think more prevalence of mental health resources when discussing health plans would make a lot of difference.",1
487,Talk about it. Treat it like any other form of illness or disability. Encourage open discussions or support groups. Give as much exposure to mental health issues that are covered by benefits as you would to any other disability or sickness.,1
490,I don't know,0
491,"I'm seeing a trend in the right direction of open conversation about it, but only in small pockets of the industry. It needs to be normalized more widely. The biggest challenge is the stigma. Even places that offer mental health care as a benefit don't do a great job of communicating it because it seems to be a taboo subject.",0
496,Continue working to destigmatize it.,1
498,"Make it easier to find out benefits related info (like  copays that apply to MH visits, etc.) or make a central resource of ""Here are some great mental health locations folks have recommended in the past if you're thinking of looking.""",1
499,Eliminate bro culture. Become more accepting of all people,0
500,End the stigma! Make it easy for people to seek help. Support people with schedules and work formats that work for them.,1
502,Destigmatize discussing and getting therapy and other treatment. Allow people time off for mental health just like for physical health. ,1
503,"Be much more open, provide proper policies to discuss procedure and how the company can help",0
504,"I think there are lots of people in tech who could use assistance, but who don't get it.",0
508,"create psychologically safe workspaces for all. Not just talk about it, but build that into the culture. Tech is a very macho industry, focused on appearing as strong as you can, while pouncing on the weaknesses of others.

If seen (not literal) urinating matches, where devs try to determine a pecking order of superiority and become the alpha male, who's word is to be taken as gospel; whatever they say is best practice, not because it's based on some real authority, but because they said so.",0
510,Talk about it more often.,0
512,"Act like it's real, common and treatable. Support mental health like any other supported employee issue (physical health, family leave, bereavement, etc.)",1
513,Let them know about the support.,1
514,"Awareness, kill the stigma, a chemical balance in the brain is just as physical as a broken finger",0
515,I think there could just be more of a focus on providing breaks (whether vacations or just time away from the desk/ work) that would alleviate a lot of strain.,0
516,Talk about it more. Be more open and direct.,0
517,just read reddit. Compassion? .... QED,0
520,"accomodation for folk with ADHD, which i know there a ton.  we're not lazy, we want to get things done.  sometimes we just can't",0
522,Talk about it more so as to be open about it,0
523,"I think no employers do very well in this area, as America as a whole is terrible at the acceptance of mental illness as a disease and treating people with it with compassion.",0
524,I think there is always room for improvement. I don't really think it's specific to the tech industry either. We just need to get rid of the stigma surrounding mental issues.,1
525,"Encourage employees to have non-work time - so much of the industry is focused on ""working when you're not at work"" either on assignments or side projects in order to get anywhere, and it's incredibly counterproductive to mental health.",0
527,Avoiding heavy workloads and providing paid time off to spend treating or recovering from mental health issues.,0
528,"Stop advocating late-hour work and meeting impossible deadlines as the cool thing to do. Openly admit to feelings of anxiety or frustration or depression, especially from people in leading roles. Look for ways to maximise ""effective work"" rather than ""8 hours a day"". Allow (and applaud) taking a break if things are not working. Allow (and applaud) taking care of not work-related issues if they are worrying.",0
529,Talk about it openly and make it known that you can seek treatment without fear of stigma or other negative repercussions. Discipline for those who speak badly of colleagues with mental illness. ,0
