773,"Discuss mental health as frequently and openly as physical health, and explicitly call out things like ""taking a mental health day"" as a perfectly valid and encouraged reason for using sick time.",0
776,Provide mental health days and wellness programs. Remove any lingering stigma around mental health by having influencers be open about their struggles.,1
777,in office therapists?,0
779,I think the biggest step would be to recognize that demanding long hours and constantly high levels of performance from people is not sustainable. I also think more could be done to be supportive to people experiencing issues and more education in the tech industry on the significance of mental health issues would be great. ,0
780,Talk about it more openly during new hire onboarding and annual benefits selection — some signs to be aware of and resources available.,0
782,Conduct some family events occasionally.,0
784,"I think they could provide more support with helping guide employees with mental health issues toward blending in with the rest of the workforce instead of treating us like we are crippled or inferior to those who don't identify as having these issues, and generally provide more support and guidance as well as not discriminating in their hiring practices at the start. ",0
785,I dont hear much about this either way tbh so really can't comment effectively,0
786,Open 1 on 1 communication with employees. Better benefits disclosure.,0
790,They do poorly the field is wide open for improvement,0
792,Be more open. Actually care. ,0
793,Tech industry seems to offer a lot of benefits such as health plans as incentives to join however the type of work involved is demanding which may have a negative affect on mental halth ,0
795,instead of pushing people to their limit that should focus on reasonable goals and timetables to reach them,0
796,Better support for mental health care providers. If insurance paid for ongoing mental health care more consistently.,0
797,EDUCATION,1
798,"I consider myself lucky in my current job position. I co-founded the project, I have been there from the beginning. The company is still small and I am essential yet. The relationship I have with my co-workers is really close. The human side of all of us is strong. All these things make it possible to be understanding with my personal situation. If I were in another more ""traditional company"" is possible that they are less compassionate with me.
",0
800,Its not often talked about even though most developers show symptoms,0
801,Reduce competitive pressure with coworkers. Encourage cooperation.,1
806,No.,1
807,Pay for treatment.  Offer in-workplace counceling,1
808,awareness. access to resources and education on the subject. in house therapy. ,1
811,Reign in overtime and better handle project timelines. I feel most tech workers are way overworked and there's always pressure to get more things done in less time.,0
812,Begin to explain through open discussions the nuance behind the diverse variety of potential issues. Create systems to facilitate those with mental health constraints to function similarly within the same domain as those without.,0
813,"create awareness programs, provide help and support",0
814,"I think clearer boundaries need to be set so that employees recognize that their mental health, like their physical health, is their own responsibility. Employers can assist folks with resources, but employees are accountable for accessing those resources to keep themselves healthy enough to perform their job functions. If these resources aren't enough, then employees need to feel comfortable moving on to more accommodating arrangements for themselves. Employers aren't medical care givers, as an employee I would not want them to be, and employment arrangements must be mutually beneficial.",1
815,drive employees less hard in the first place,0
816,"Understanding and acceptance. Like a physical aliment it isn't going to go away once you understand it, it's going to take time to heal. ",0
818,Coverage for mental health treatment.,0
820,Talking in a way that affirms that some employees may have these issues.,0
821,discuss mental health support with all new employees,0
822,Companies should be more explicit about the mental health resources that are offered.,0
825,Allow people time off to get the help they need... no questions asked,0
826,"Take the same amount of positivity and anonymity zeal when proactively asking employees to report potential ethics violations, and do the same for potential mental health needs.",0
829,I think the industry should be more vocal about these issues. Companies should let employees know what resources are there and that they will help and accept them. I have never heard a company mention mental health as a concern before.,0
830,Create more processes and make more clear what obligations an worker has with the company.,0
831,Na,0
832,"We're getting there, but still too much focus is placed solely on burn-out, and breakdowns still build up with alarming regularity. ",0
833,"I just hope we make it more acceptable to talk about mental health. Let's all download Stop, Breathe, Think on Slack and meditate together.",0
834,Ban the crazy culture of working non-stop 365 days a year! Breaks should be encouraged and a healthy balance of work and rest should be the default expectation in all workplaces. ,1
836,"They could identify specific issues and problems that IT workers are likely to encounter in their positions. As the job market begins to incorporate tele-commuting and alternative workplace environments, issues can arise. Employee should be supported and provided with resources to help them adjust.",0
837,"I feel it offers greater support than other industries as it has a strong focus on work-family-conflict and out of work demands, great number of tech-related health efforts and support",1
838,Stop treating employees as disposable brains.,0
839,Treat mental illness as any other disease or medical condition.,0
840,"Stop interview processes such as whiteboarding, live coding, etc. These cause a lot of impostor syndrome in candidates and cause many of them to beat themselves up after a bad interview.",0
841,"Industry: Actively work to replace the stereotype of a developer - you know the one, the stereotype is that a programmer doesn't need sleep, can live off of Soylent or Doritos and Mountain Dew, can execute bug-free code for like days on end without getting up from their desk - with one that is more humane. Programmers are people, jeesh.  Employers:  Don't be assholes.",1
843,More awareness!,1
847,"Awareness of how IT work affects mental health, awareness of resources, destigmatize, community",1
848,More open discussion and treatment options.,0
853,Employers of small- and medium-size companies don't pay ANY attention to employee's health. The only thing that matters is making the money.,0
855,More exposure and info sessions about it would help.,0
856,No idea,0
857,"discourage constant use of computers and social media, encourage normal work hours, firm protection policies for leave and mental health issues, full health coverage for all types of health issues. ",0
858,Create awareness about mental health,0
859,"Encourage more open discussion to remove stigma, encourage team members to think of mental health issues as similar to physical health issues.",1
860,Better consideration of the purpose of work. More confidence to employees. Leave behind traditional practices that consider presence at work (doing you hours) more important as the actual work done.,0
861,"Give more information, treat people kindly and with respect, and be open to discussing about mental illness",0
862,Take steps to reduce burn-out. Be more open about mental health for everyone.,0
863,N/a ,0
864,As someone who has not suffered from mental health issues I'm not really qualified here.,0
866,Even though my experiences are limited I'd say that the tech industry as a whole is more aware of mental health issues than most fields.,0
868,I think it's a taboo topic in every industry and it's normal to take days off on a physical issue but not mental,0
870,Generally continuing to talk about it,0
872,"Benefits are often provided and support lines provided but it usually is the extent of what they will do. Often in discussing openly, people approach you differently and often not in a good way.",0
873,allow remote and flexible work to accommodate appointments;  discuss mental health when onboarding new employees and talking about benefits; promote diverse people and background to normalize,0
874,Increase services and awareness ,1
875,"I think the first step is acknowledging mental health as a priority in the tech community. In this industry, there's huge emphasis placed on output of information, data, and tangible results - often at the expense of the employees actually producing these results. Recognition and acknowledgment on a real, fundamental level would do a lot to change companies' stances on mental health. ",1
876,Get rid of open floorplans; allow more work-from-home days. The constant distractions from other people is aggravating.,0
877,More emphasis on things like meditation and other techniques to increase happiness,0
878,Raise awareness - mental health is mostly like physical health. Diabetes and Depression are both caused by the inability of an organ to regulate chemical balances in the body.,0
880,Encourage people to look after themselves before an issue,1
884,Be open about mental health services and provide similar perks to the physical health perks many are providing and talking about,0
885,Be clear that we are humans and that feelings (good and bad) are part of our lives and jobs,1
886,"Keep in mind that too much work is no good, do meditation and breath sessions during the working hours",0
888,I think big corporations do a better job than small companies or startups,0
889,"They can create an amusement center for the employees. they should provide a proper time of leisure for the employment. The employee should give enough time to their family. And the most important thing is that, every employee have to be given safe environment of job security and freedom as much as it can be able.",0
890,Stop putting white men in charge. Provide positive support for individuals who self-identify.,0
892,Make sure that mental health options are clearly outlined in employee benefits literature.  Provide employees a safe place to talk if need be like an EAP.  Provide quiet rooms and personal spaces to find time to relax.,1
893,I don't have a mental health issue so I am unsure. ,0
895,Manager training to understand mental illness and how to respond in at least a non-toxic way. Understanding for work accomdations (i.e. WFH).,0
897,realize when treated a person will provide good work and when it isnt treated the company will spend more money on sick time and ok work,1
898,We could talk about it. We could stop having businesses that have crunch times. We could make it easier for folks to know what mental health options are available. We could stop stigmatising mental health as a society.,0
899,"Meaningful support, at a minimum, in the form of acknowledging mental health and encouraging a non-stigmatized attitude toward mental health issues.",1
903,Normalize it. Encourage healthy work/life balance. Discourage hero culture.,1
904,"More outreach, more understanding of limitations (too many job adverts that list going above and beyond/being a ""rockstar"" etc. which is inaccessible to people who need time to decompress and need periods of less stress between projects). More openness in general.",1
908,Evaluate team performance instead of individuals.,1
909,Good healthcare benefits and work accomodations with no bias against them (such as allowing people to work remote more often if needed) - also training people to have some empathy towards their coworkers,0
910,"Actively talk about it as just a normal part, similar to (physical) wellness programs",1
911,"I have seen it become a more openly discussed issue; not just through OSMI, but other people that I know both personally and as public personas discuss how the tech industry handles mental health issues.",0
912,Continue to reduce stigma. Particularly bad amongst older developers where there’s a cultural difference. ,0
915,Stop expecting everyone to work free overtime! I hate that it's an expectation that you code all but 24/7. That's not good for my mental OR physical health.,1
918,I think all companies would benefit from the work OSMI does. I think having an open focus on mental health on the same level as physical health in the organization would be beneficial. ,1
919,"One thing that bothers me is that a lot of companies seem to think that being a ""lifestyle"" company means putting up a bar at work. ",0
920,"Try to make sure that people are aware that mental disorders are NOT caused by someone being ""weak"" or ""undisciplined"", but that it's often times due to a physical issue (i.e. brain doesn't have as many receptors or has too many receptors for a certain type of chemical, etc).",0
921,OSMI helps opens eyes of those who do not suffer mental illness,0
922,"The tech industry is filled with trolls and fiends who like to feast on people's emotional state. Its a highly competitive field and people actively use this against other, for instance a socially inert chat group on StackOverflow - filled with people some of which are not very good talking to people openly and suffer from severe pitfalls gets targeted on twitter for days. Why? Because they were a little rude to someone who wasn't trying to participate in the chat actively. The person who tweets gets glorified but as a result this safe-place gets destroyed.",0
923,We should talk about mental health as much as we do physical health. We tell people not to come in if they're sick but no one talks about mental health days.,0
926,"prioritize wellness and balance, provide early intervention without judgement- mental/emotional  first aid and positive preventative care",0
929,"I'm not entirely sure. I think the tech industry might be one of the more accepting industries, but there's still a pretty big stigma attached to mental health issues.",1
930,I don’t know. I don’t feel qualified to answer. ,0
933,therapy should be covered by health insurance benefits,0
934,There is a lot of pressure to perform and accomplish a lot of work quickly.  More open acknowledgement of how common mental health issues are and how high pressure situation can create mental health issues would hopefully destigmatize them.,0
938,"I think slowly restoring the ""self-care"" time of employees is a big first step. Having the ability to disconnect from being responsible 24/7 for the health and wellbeing of a computer service is important. And not just on scheduled vacation times, but regularly and generally as a rule. 

The best thing I've gotten is being in a results-based work flow. I'm not required to be at work at a time, but to get work done. This allows me to have my own Self-Care moments or days without worrying about not being ""there"" for work.",0
940,The industry is very focused on productivity to the point that anything that takes away from it is hidden.,0
941, ,1
943,Be proactive and open about it. Actively talk about it in the workplace and normalize these things instead of waiting for incidents to happen. Change the mindsets and promote an open culture.,0
945,Keep trying to eliminate the stigma of it.,0
950,There should be a greater understanding of how our work is affected by mental health issues. Employers should know that everyone has a health issue of some sort (or will occasionally) and it's not something that should carry a stigma.,1
951,"Talk about it more, encourage working fewer hours, taking longer breaks, better work/life balance",1
952,"Keep talking about it and breaking down the stigma. Outright offer ""mental health days"" or make it clear that ""sick days"" can and should be used to deal with mental illness, exhaustion, stress, etc. Stop treating it as different from a physical illness.",0
953,They don't care about your mental or physical health. They just want deliveries and there is never a break. The inefficiencies caused by mismanagement come down to the dev/qa teams to make up that time. They expect factory work and treat you are replaceable if you don't keep churning out code.  ,0
955,"Less stigma, more open discussion.",0
957,less of a stigma,0
958,Acknowledge that MH issues are real and have a profound impact on tech workers who use their brains to work. Depression has blunted my memory to the point where I don't remember simple things (I have any number of Stack Overflow bookmarks). The treatments are often as bad as the diseases. My antianxiety medication makes me fuzzy and apathetic. My friend who had ECT suffered *severe* memory loss and was unable to do her job for several weeks even after she was medically discharged.,0
960,Normalize treatment and suffering. Let people have space to deal with issues and do their best work. ,0
961,it is more socially understood and acceptable in the tech / younger environment,0
962,"Employers need to understand what mental illness is, that it shouldn’t be a stigmatized condition, and that there are ways to help those who suffer just like they’d help someone with the flu. ",0
963,"Become more involved in the acknowledgement and support of these issues.  Training of leadership to know how to deal with different issues and even use them to the employee's advantage when possible is important.

And yes:  I do believe you can use things to an employee's advantage/advancement (such as hyper-focus).",0
964,"I think that the tech industry overworks employees, and because of the intellect required to do some of this knowledge work, they assume that mental health issues are in direct opposition to that work. People work long hours without much consideration for their well being.",0
965,Discuss mental health more openly.,0
967,"Be more open about it, first and foremost. The technology field is super emotionally disconnected. Which is interesting, because I imagine there's a fair amount of autism genetics floating around in the field—which are known for less emotional response. More talks at conferences, more awareness campaigns and things of this nature will help a lot with the emotional wellness of the industry and, since the industry has such an impact on modern life, the emotional wellness of a lot of walks of life. ",0
970,"High stress cultures and burnout can exacerbate mental health symptoms in those prone to them. Treating employees like people, not machines, helps. Flexibility and open mindedness help.

As tech has become more mainstream, tech jobs have become less friendly to people with quirks and eccentricities.",0
971,Magically make everyone more empathetic,0
972,Offer more mental health care and make sure employees are okay.,1
973,I haven't worked anywhere with good management that could improve on this specific issue.,1
974,"Be more flexible with time-off, be more open to talking about it.",1
975,"I think a lot of the tech industry pushes people towards burnout by encouraging people to be constantly working, both at work and outside of work. There's a general idea that making things at work isn't enough, that your job should also be your hobby outside of work. I think this is unhealthy and people should have different outlets and interests they're pursing in their free time. We don't expect people who do sales to be selling outside of work, why expect people who code for a living to also be coding outside of work?",0
976,"For my issue, all that I want is privacy, and I feel that every employer for which I've worked meets that requirement.",0
977,Provide free professional services,0
978,Better support/training for people so that everybody isn't expected to perform at 1000% 24/7 in a way that is particularly unsustainable with mental health issues.,0
979,more resources. especially as a large amount work from home,1
980,Not sure. This is a problem with broader societal forces in my opinion.,0
981,"Stop glorifying high-anxiety positions and portraying ""crunch-time"" as an industry norm. Alternately, make it possible to search for jobs that are sensitive/understanding around mental health concerns and don't raise anxiety as a standard management technique.",0
982,"Work towards removing the stigma and focus on mental/emotiona/physical health. Often the industry values you as a productive worker, not a complete, holistic, and healthy individual.",0
983,I'm not sure there is a solution in a context where profits dictate decision making - ie capitalism.,0
984,"Stop lionizing and promoting manic episodes as normal or desirable methods of producing work. The culture doesn't allow for enough self-care — when you have to work 12+ hour days, then respond outside office hours to emails/IMs, it's difficult to build in enough time to sleep enough, or take breaks for meals, or exercise, or meditate. The glorification of people who spend their entire lives working in a frenzied trance state is extremely difficult to live up to, and a potential trigger for mania. ",0
985,State explicit support for taking sick days for mental health issues. State explicit support for employees who are dealing with mental health issues and say that they are just as important as physical health issues. Offer health insurance plans that subsidize or cover mental health. Be more aware of addiction/alcoholism recovery and be more sensitive/sensible with work events.,0
987,"Talk about it early and often, as part of company meetings, normalize conversations around mental health. Describe the process end to end what it would look like to ask for help.",0
988,"It's not discussed very much. Additionally, the tech industry as a whole is ripe with potential to exacerbate issues for minority workers.",0
989,Normalizing more healthy work habits. Too many employers talk positively about mental health but still promote unhealthy work hours and habits,0
990,Promote mental health more and allow employees to take mental health days. Allow much more PTO or a generous work from home policy. Let people step away from the stresses of work more frequently to improve their mental health.,0
991,"For starters, be aware of what mental health entails/encompasses. Learn how it is that an employer can help, or support someone with mental health issues. Finally, be understanding/endorsing of ""mental health days"". My brain is my toolbox as a software engineer, sometimes I need a day just to polish the rust off.",1
993,"The industry encourages long hours, an unhealthy work/life balance, and perfection. Having time off and encouraging taking time off for employees would be a step in the right direction - it might lead to temporary losses (1 less person to work on a project), but would be beneficial for all parties involved in the long run.",1
994,"Tell employees what their plans cover for mental health. Cover psychotherapy session out of pocket costs when insurance does not fully cover. Getting the right therapist that’s also covered under insurance is almost impossible. Most of the times the good ones don’t accept insurance so I had to pay out of pocket, I used up most of my flexible spending account with this but if I didn’t have that I would have been in trouble.",0
995,"Talk about mental health. Abandon the ""startup"" ""all work, all the time"" mentality. Focus on building trusting relationships. Communicate. Integrate the whole person into the workplace, not just the professional front we often present.",0
996,Better education around what mental health looks like and how to know when you may need to seek additional help. Also better training around how to respond to someone's mental health condition.,0
997,More open discussions about mental health and how to support it in the workplace.,0
998,"No one speaks about mental health aside from encouraging yoga along with gym time. No one in my company speaks about mental health issues, in general.",0
1000,"Focus more on work/life balance, people who overwork and the teams that encourage this, try to provide support for the whole person (physical, intellectual, mental, etc)",1
1001,"Understand employees/job candidates who have mental health problems and learn to work with their abilities. I feel like employers today are entirely focused on production, and if the person has problems that could affect their quantity of production, employers have no problem getting rid of them or not hiring them.",0
1002,"More generous leave policies for employees dealing with mental health issues. Ability for employees to take leave to care for friends in crisis, not just family members. Many employees in the tech industry do not have families but still have close friends who need their support too.",1
1003,"Some employers are really good about letting people know about the physical health benefits they get from insurance, but they neglect the mental health benefits. At a previous job (not tech related) there were services available for mental health that I didn't find out about until I had an anxiety attack at work. Had I known about the services that were available, I could have gotten the help I needed before my work performance was effected.",1
1004,"Talk about it, destroy the stigma and give people resources to cope.",1
1005,Would be nice to see more companies actively pushing employees to take time for themselves.,0
1006,"I'm not sure how to judge the entire industry. I feel that some companies completely ignore it from a historical lack of admitting emotions in the work environment and others allow employees to take time off, work from home, have less structured days/offices to help. It is really split high/low.",0
