531,"Understand that we're a lot of (mostly) very intense perfectionists who are working under stressful circumstances, and incorporate workplace perks to minimize resulting burnout, depression, anxiety, etc. ",1
532,I think it's not so much the tech industry as a whole as it is the type of company and their values.  I've worked for companies where you are expected to leave your problems outside the door of the office.  I've worked for companies who want their employees to bring their whole selves to work.  To be very general my experiences are that the larger/older companies who in the past did not emphasize employee mental health as part of their company values have harder time supporting mental health than smaller/newer companies. The idea that mental health and work life balance should be protected and encouraged by employers is a relatively new thing (at least it seems that way to me).  I feel like the smaller or newer the company the easier it is to create the infrastructure to support employee mental health.  ,0
533,"Boundary setting from the executive level up as far as working hours. Offering job ""perks"" that aren't just the MINIMAL legal requirements but aspects that actually improve and instigate better self care (whether that be resources to access or actual stipends to be able to access those resources in practice). Setting reasonable expectations as far as communication and culture. Diversifying your employee base.",0
534,"Flexible hours, better work planning, more focus on support services for the work",1
536,More emphasis on the importance of positive mental health and less stigmatization.,0
537,Respecting work/life balance would be a big first step. Past that making programmes & funds available to people. ,1
538,I can not speak for an entire industry.,0
539,I think the tech *community* is at least more aware of it than other industries with which I am familiar.,1
540,"Call out health benefits and treatment options as a part of the benefits package during onboarding, and repeat this option throughout the year (how can employees take advantage of a benefit that's never discussed?). We should discuss mental health in the same straightforward way we discuss physical health. Talk openly about how mental health, stress reduction, and work life balance are a priority for the company, and then follow through with action. Provide multiple healthcare plans so that employees with mental health issues can choose the plan that's right for them--for instance, a low to middle income employee with a high deductible healthcare plan might find seeing a therapist to be a financial burden if they have not yet hit their deductible, thereby preventing them from going to therapy at all.",1
541,"Offer scheduled group discussion on the matter, with options to share personal experience.",0
542,I'd like to see more open discussion about the relationship between intellectually/emotionally heavy work (as that in the tech industry often is) and mental health.,1
543,"I'm not sure, just keep providing benefits and making accommodations for people.",1
544,"Get rid of this stupid stigma attached to it. My company is fantastic for NOT having this, and being very supportive about positive mental health, but I know other employers are not. Also, make getting help more transparent. Even though my employer always talks about taking mental health days, if I wanted to go to talk to a doctor, I wouldn't even know if it was covered.",0
546,Opened and support when people are suffering. To accept mental illness as a part of everyday life,0
549,Perhaps there should be some sort of training or education around mental health and diversity and acceptance.,0
550,More time off with less explanations.  EAPs.  Flexible schedules and work location.,0
551,"I think that for recurring services (like mental health providers, appointments, prescriptions, etc.) High Deductible plans penalize those who need those services at the beginning of the plan year. As employers seek to reduce health insurance plan costs, and as more and more employers only offer HDHPs, they should consider the option of front-loading employee's HSA/HRA plans or wellness incentives so that employees with mental health issues don't have to go through the choice of poverty vs Health while they try to meet their deductible, or the humiliation of asking for a pay advance so they can cover their bills.",0
555,require everyone to have a therapist,1
556,"I hope that other companies are doing things like mine - allowing flexible work from home schedules, providing ""quiet rooms"", trying to be as inclusive and non-judgemental as possible. ",1
560,"I think we talk a big game of being supportive of mental health, but we lack the follow through. It's great to offer PTO, but it's not great to create an environment where you're looked down on for taking PTO. Similarly, it's not great to create deadlines that put unnecessary levels of stress on people, and then repeating it over and over again without allowing time for recovery. I've seen both of these happen.",1
561,More awareness/support,0
562,"Make it approachable, it's not just something for IT, but in general. For a lot of people with mental health issues it's already difficult to talk about it, so there should be a safe environment where people can talk about it.",0
566,"Overcome the ""sleep is for the weak"" and ""I eat stress for breakfast"" culture of startups.",0
567,We need to increase awareness of mental illnesses and work at getting rid of the stigma surrounding discussing them.,0
569,Be more understanding and empathetic towards the complications of having one.  ,1
570,Offer assurances that people could get help and possibly even be hired without being discriminated against because of any mental health issues.,0
571,"When someone is suffereing from a mental illness, their performance my suffer. If an employer is unaware of the issue, they may assume the employee is lazy or looking for another job. Employers need to reach out and be empathetic. Assume the employee is not performing well for a reason. And offer to help. ",1
572,"Raise awareness, be open, support affected",0
574,"Better health care coverage, providing alternate work arrangements, not treating others as strange for having mental issues ",0
575,Not demand perfection of employees.,0
576,"Keep schedules flexible to roll with the punches the employee might be going through on any given day. Encourage open communication on both sides. Full medical benefits, including therapy. Also, an Employee Assistance Program for employees to call when in crisis to have someone to call and talk to and get a rapid referral for 8 therapy sessions (EAPs do a lot of other awesome things too!) FSAs, so employees can afford medication and treatment at a pre-tax rate.",1
577,"I think we do OK. That said, I think we're demographically predisposed to people with mental health issues. Who else is attracted to a field of very intelligent semi-solitary misfits working marathon hours?",0
581,Mental health first aid training. Talking about it openly.,0
582,"Oh gosh, that's a huge question. Mainly be kind and patient and provide support options.",1
583,"Train line managers to handle it, and have guidelines for things that would help. Also more mental health first aiders and mental health sick days. Also therapy should be included in health benefits",1
584,not sure,0
586,Provide additional resources and avenues for accessing mental health support outside of the employee hierarchy (eg without going through a superior),1
590,"awareness of the normalcy of it, and more options for getting help",0
594,Break the stigma around mental health,0
595,"you have to reverse the stigma, let people know their jobs aren't at risk",1
596,dont know,0
597,"discuss options in healthcare plans, more discussion about services, offer free counseling services.",1
598,"I think that there is a lot of drinking in the tech sector, which leads me to believe that there is a lot of undiagnosed mental health problems. Many tech companies encourage alcohol consumption by hosting happy hours or having alcohol available for employees on site. This makes it hard for people who have problems with alcohol to either abstain from alcohol, or speak openly about their struggles with it. Additionally, the normalization of excess alcohol consumption can lead to mental health problems themselves (e.g. Depression and anxiety). ",0
599,being more open about privacy and clear about policy,0
601,"It varies wildly by company.  I've had really good experiences, but I know at least one friend who works in a different part of the industry who has struggled.  Like anything, it depends on the business and specific managers.",1
602,Allow more flexible working hours. Stop focusing on working too much overtime as a proxy for productivity. Treat mental health issues as physical health issues (and handle both better!).,1
605,More open communication about the issue.,0
607,Avoid a culture of relentless pressure,1
608,Show examples or successful people who have been open and not stigmatized ,0
610,Awareness. Especially in small shops or startups. ,0
611,Talk more! But respect privacy too ,1
612,"Accept that we're all actually humans and that's ok. Don't frame negative behavior (alcoholism, antisocial, work obsessed) as positive.",0
613,"Become more acceptable of it, such as explicitly allowing sick time for mental issues besides physical",0
614,"Encourage conversations in the workplace about supporting ourselves and each other through challenging times. I think everyone experiences reactions to stress, pressure, grief, and troubling life events. If we have an open and friendly policy about staying home from work with a fever/illness, we should also be open and supporting about caring for mental health in similar ways.",1
615,Eliminate use of the phrase “burnout” and discuss symptoms. ,0
616,I think it's still not talked about in a way that's supportive. Work culture needs to be more flexible to allow for things like appointments or just general flexible work time. ,0
617,Reassure people that there won't be negative consequences to talking about a mental health issue. Educate employees about how to handle colleagues' mental health issues sensitively,1
619,Be a lot more explicit on their processes and procedures. Be pro-active voices in the industry for good mental health support and help remove stigma,0
621,"Change culture of extremes, seek balance, flexibility",0
622,"\- too much focus on individualism which leads to isolation
- include mental health issues in the reasons why someone might take a sick day/PTO
- acknowledge the broader social context and how it affects people; e.g. #metoo has had a big effect on a lot of women - both empowering but also re-traumatizing",0
624,Having more people high in the management chain talk openly about their mental health issues without retaliation ,0
627,"The majority of the tech industry only pays lip service to true work/life balance. They talk about how important work/life balance is but they only truly reward the workaholics resulting in the crazy 50-60 hour work weeks and crunch time stories we all hear about and experience. Tech companies are designed as engines to turn youthful ambition into money in the most efficient way possible ... by burning through people and only keeping the absolute strongest, luckiest, or most ruthless.",1
629,Normalize mental health issues and support for them.,0
630,"I think there is a great deal of pressure to work 60+ hours which leads to stress, anxiety and other mental health issues. Eliminating the pressure to work on vacation and take time to recharge and focus on personal care is important. ",0
631,Create an environment where it's OK to talk about it and get help without the fear of judgement and negetive impact of possible work/promotion opportunities,0
632,"Stop being such fucking assholes, learn something about the topic, stop othering people, get some therapy, and learn to actual appreciate diversity instead of just talking about it.",0
633,"Discuss mental health coverage in health-care benefits, discourage overworking, encourage people to take PTO and other time away from their desks, etc.",0
635,Previous employer had a psychologist come in once a week and any member of staff could privately book a session. More initiatives like that would be good,1
636,"Reduce stigma, stop glorifying overwork, treat mental health like physical health, focus on long-term employee outcomes, value employee well-being in and of itself.",0
637,Better awareness culture-wise. Admins letting employees know about options for treatment/time off,1
638,More understanding.,0
639,Follow the principles of compassionate coding. Stop promoting psychopaths. Treat gaslighting and mental torture the same as we treat sexual harassment.,0
640,Mental health is not separate from physical health.  Removing that stigma would improve access and acceptance.,0
641,"I'm not sure -- at a certain point it seems like it's an unfair burden to the employer. There is a limit, I think, of what you should expect others to do for you.",0
643,"Raise more awareness, create an environment where openness and respect is celebrated. ",0
644,Talk about it more.,0
647,More pressure on employers to offer support and guidelines for employees,0
648,Increase awareness for support.,1
649,Boss should talk openly about the benefits of mental and physical health.,0
650,Talk about it more. Offer wellness services. Remove the stigma.,0
653,Talk about it. Make sure folks know their options. Be open about struggles you've had/been through.,1
656,"Make a pointed example that everyone has mental health issues, and to treat it as less of a stigma.",1
657,improve the openness and acceptance of those with mental health and physical health issues,0
658,idk,0
659,Encourage employees to have regular mental checkups just as they would physical ones. Broadcast what mental health benefits the company provides and encourage them to use them. ,1
660,More awareness that mental health issues are very common in tech,0
663,"I think everything we've done, mental awareness wise, has been led by one awesome employee and the company facilitates it but they don't do a lot on their own. We are more open about it than other workplaces but it could be better if the company owned more of it",1
665,I think we should all talk more openly about mental health.  That also requires that we have empathy for those that do talk about it.,1
666,"Ensure insurance provides coverage, be flexible with personal time",0
667,?,0
670,I really don't know. Just acknowledge the elephant in the room and don't make it a problem but a way of leaving/working.,0
671,"Implement practices that would avoid the stigma of mental health disorders. We are all alittle crazy, right? ",0
672,Ensure that mental health services are available and covered by insurance.,0
673,A better focus on putting all employees into a position to succeed.  Would depend from person to person.  ,0
676,Start talking about it,0
677,Encouraging more openness. Providing enough paid leave and time for things that aren't work.. having your whole life and identity wrapped up in work is damaging. ,1
679,OSMI should be have resources specific to UK industry :),0
681,get rid of 40hr weeks,0
684,Remove the stigma of just talking about it,0
686,"Provide a lot of resources up front (upon hire) and then ongoing.  This would show that it was a priority and serve as a constant reminder (which matters, because you might not have a crisis when you're hired, and therefore might not seek out resources at that time, but could later on.)",0
687,It seems that almost every dev I met had a burnout or depression. It would be nice if employers acknowledged it as a normal part of life and learn to just deal with it.,0
688,"Cut out the [achievement, bro, toxic masculine] culture. Acknowledge mental health as a normal thing that just happens.",0
690,In general I think most of the tech industry places work ahead of personal health and contributes to mental health disorders,0
691,"Employers should provide mental health benefits, clear guidelines around how they'll support someone suffering with mental health issues, awareness of mental health issues, training for managers / leaders so they are aware of the signs of mental health issues (burnout, for example), and show an acceptance of those dealing with mental health issues.",1
692,Mental health care should be standard in benefits. Flexibility in schedule and responsibilities should be available when necessary.,0
693,"First, acknowledge it exists. Second, educate people so they understand that a person is not a disorder. Those first two steps alone could take a really long time.",0
694,"I think the tech industry is better than many other industries at highlighting the importance of mental health, but there's definitely room for improvement. Also, I have an unfounded feeling that given the types of people attracted to the industry, there's a higher-than-average incidence of mental health issues, which means that the tech industry needs to be leading the pack when it comes to informing about mental health issues and caring for employees with mental health issues.",0
695,"I don't think is an issue from the tech industry in general, but mental health issue is still not fully viewed as a health issue. This can be easily represented as the number of times that your plan covers your appointments with a therapist. I haven't ever seen a plan that would cover you indefinitely, most of them cover 10 sessions in a year. Because the mental health is a lot more common on the tech industry it would be necessary for this industry, especially really big corps which are viewed as role examples, to push for a more significant change on that aspect.",0
696,Make it OK to talk about.,0
699,Employers need to be aware of mental health issues and how common they are. They also need to create an environment where those issues can be disclosed without worry of losing one's job.,0
700,Don't expect excessive effort as the baseline,0
701,They want to be well intent to keep their employes,1
702,I think the industry learned that mental health should be taken more and more seriously. Maybe be more explicit about it and explain when check mental issues with a specialist.,0
704,"Continue to advocate for proper handling of individuals with mental health issues, allow for more leniency in regards to working from home, removing distinction between PTO (sick, vacation, personal, etc) so as to allow for more mental health days if needed, continue to educate employees on how to utilize their provided health insurance plan effectively to diagnose and treat mental health issues, and provide resources to employees to seek help for themselves and others in situations where none of the above would otherwise be applicable. ",1
707,Just talk to each other,1
708,"More open discussion, more time flexibility, less hectic work schedules",0
709,Make it clear that there are options available.,0
710,"Talk about potential mental health stressors typical of tech work, have options for evaluation and coverage made clear early in a new role.",0
713,Industry thinks that the brain is something that a person can control.,1
714,Openness about options and financial support. ,0
716,"On an individual/peer level, I think there's some awareness that a lot of us have ""social"" issues that are sometimes related to mental health disorders/issues. It seems like that would give people in our industry at least a step up in handling the conversation. My experience seems to reflect that. On a more institutional level, I'm not sure of a best course that would fit all. In my personal experience, efforts toward supportive conversation and connection to relevant resources were lacking from management, so that's a good place to start. ",0
717,"Prevent burnout. Seriously reprimand or give negative reputations to companies that allow burnout and have burnout as part of the culture. Burnout as part of company culture looks like working longer than 8 hours a day; having PagerDuty go off in the middle of the night for someone who isn't on-call; not allowing employees to unplug during vacation. Ways to prevent burnout: Allow employees to unplug when not working (nights, weekend).

Never let it get to the point that an employee commits suicide due to working conditions.",0
720,"many companies have a culture of output with little to no compassion for the mental health of their employees, which is ironic because our mental facilities are the only tool we have to create output",1
721,Less emphasis on long hours,0
723,"Educating team members to understand how and why people act when they are affected by a mental health issue. And to let them know their capabilities for caring for themselves and what will be supported. (i.e. working from home, taking leave, flexing time, etc.)",1
724,"Better coverage, allow remote work no questions asked. ",0
725,"More benefits, more acceptance.  ",0
727,Just bringing it up ever,0
728,"Be a bit more active in their support. I think most places would work something out, bit nothing is prepared in advance.",0
729,Not sure,0
730,"Mental health is not widely acknowledged as an issue worthy of accommodation without documentation. One cannot have a mental health day as easily as one may have a sick day for a cold, etc.",0
731,Weekly counseling. Motivational speech. Family get together with office colleagues.,0
732,"I think raising awareness and showing employers that mental health issues are REAL, but also showing examples of successful employees who have mental health issues.",0
733,More open communication about it.,1
734,Talk about it more. Emphasize mental health the same as physical health (we get checked for tobacco use & have an onsite clinic - nothing similar or even a meditation room onsite),0
735,"Awareness, sick days ok for mental health ",0
736,Improve visibility,1
737,TALK ABOUT IT. Learn to talk about mental health and about how we feel and how we experience the world.,1
738,"Mention it as a thing that exists without blame or shame. Publicize the resources available, like employee assistance plans. ",1
741,Try to remove the stigms around discussing such things and seeking help.,0
742,Its talked about and not shamed,1
743,Be supportive,0
744,"My belief based on managerial observations is that the tech industry involves intensive thinking, so anyone you has mental health issues in one area of their life are unfit in other areas (i.e. employment).",0
745,"As I see it being talked about at conferences, I think the more we can educate others about mental health issues and how to be supportive, the better and more supportive we can be.",0
747,De-stigmatize mental health concerns,0
748,Stop focusing on Rockstars and making it impossible to take time off,0
749,Be more educated that mental health issues are common and do not make a person less capable of being productive contributors to the company's success.  Be flexible and understanding when employees need accommodations to maintain good mental health.,0
751,Encourage mental health first aid training in additional to physical first aid,1
752,"Openness, resources, concessions, flexibility when mental health issues affect work.",1
754,openness could be better.,0
756,"Since the industry is male dominated, there should be more talk to increase awareness and reduce stigma.  Offering peer support programs and role models would also help make the discussion ok",0
757,"it's a comfort thing at this point imo, needs to be talked about so it doesn't feel weird to bring up issues",0
758,"If it is mentioned at all, it's during a meeting to go over benefits. The same was true with welness programs at all of my employers. It could be greatly improved by socializing the availability of benefits and resources throughout the year--especially around holidays when lots of folks struggle.",0
761,"Be aware that mental health issues exist, but that they do not necessarily define a person as a whole.  It is part of who they are, at least for a time.  Unlike ethnicity, race, skin color, etc, it may change in time.",1
764,"They should show that normal people (engineers, accountants, secretaries, not executive) have mental health problem, are receiving non-invasive help and are functioning or getting better. But I would not accept to be the one to be shown. Isn't it ironic?",0
765,Talk about it,0
766,"Model it, talk about it. ",0
767,"We need a safe space to discuss it, we cannot be afraid of openly talk about. We are only allowed to talk about mental health to psychologists and psychiatrists, even discussing it with family is not as open as it should be.",0
768,Stop encouraging 'crunch' mentality & incentivising extreme overtime & neglect of vacation time.,0
769,"Make sure that talking openly about it has no negative effect on the work, applications and the likes. ",1
771,"Discuss issues more openly. Allow for more modified work environments (work from home, etc.)",0
772,"It seems to me, after 28-years in the IT field, that there is a much more open and honest dialogue about mental issues, perhaps due to the predilection of many with anxiety, mild functional autism, or Asperger's to gravitate to the field.

In other fields, these types of mental disorders are typically seen as weaknesses.  In many cases, people in other fields, through TV/sitcoms movies, etc., have been exposed to the higher incidence rates for certain issues in the tech industry, but mainly as a source of humor.  The tech industry should show that some of these issues can actually be pulled on as a source of strength, both as the direct result of the issue (say, hyper-focus perhaps) or through the strength of character that is cultivated in learning to overcome these issues/challenges.  ",0
